date_id, name, description
178, Brew some beer together,"You’ll need a kit or a bunch of equipment for this one, and it can get a little expensive. Also, unfortunately, you both won’t get to try the beer you brewed together that day. But then again, that could be the next date night. All that being said, though, doing something together is very rewarding."
179, Pick a dessert recipe and go shopping. Then make a dessert together","Ice cream is a great choice, there are tons of DIY homemadeice cream methods. And it would work well with the pick your own fruit date idea. But really any baked good is a great choice."
180, Attempt to learn calligraphy,"So, attempt is the key word here. You first few tries will probably be a bit laughable, but it’s easy to start because there are plenty of video tutorials online and beginner pens aren’t crazy expensive. So, give it ashot, be patient, and just remember failures can be as fun or more fun than successes."
181, Do an Arduino or Raspberry Pi project together,"This one is definitely a bit technical, but it’s easier than you might think. There is a ton of documentation out there to help you along and plenty of sample projects to choose from. Perfect if you both like tinkering."
182, Learn the rules of a sport you don’t know much about and watch a game, "You can either watch the sport at a sports bar if there is a game going on or just watch some old games on the internet. There are tons of great sports out there that you’ve probably never even heard of."
183, Choose a series of movies to do a daylong movie marathon,"Don’t forget the popcorn! This is a pretty chill date idea for those who like staying at home. Some great options for movie series: Lord of the Rings, Star Wars, Avengers, Harry Potter, Die Hard, Bourne Identity, and The Fast and the Furious. There are plenty of series to choose from."
184, Watch a movie you've both seen a bunch and try to make memes from it,"There are so many memes from movies and shows. Pick a movie that you both love and see what kind of memes you can pull from it. Post them up in Reddit. Who knows, you might get a few upvotes and people might use or adapt your meme."
185, Write letters to folks who might want them or folks who don't,"Are you both passionate about something? Write a letter to someone who might be able to do something about it. Love a celebrity or musician? Write them a fan letter. Write a bunch of letters to a bunch of people. Your local representative, celebrities, companies, prisoners, random pen pals in different countries. People underestimate the power of a handwritten letter. You might even hear back from them!"
186, Have a cooking competition with whatever food you have in your kitchen,"If both of you are comfortable with visiting the other’s house on a date or if you live together, this can be an enjoyable way to spend the evening. It forces you both to be creative and can lead to some hilarious results."
187, Find a world record and try to break it,"There are some crazy world records out there. Find a fewthat look like it would be fun to try, and all of you give it a shot. You probably won’t beat the record, but I’m sure you’ll all have fun trying. And if you do beat it, how cool would that be?!"
188, Go to a roller-skating rink,"Chances are you have a roller rink in your town and chances are you haven’t visited it in a very long time. So, head on over, lace up, and see how much you remember about skating."
189, Darts or pool,"Hit up a bar that has darts or pool and give it a go. There are lots of dart and pool games to try, so look up the rules for a game none of you has played and try it out. You might find you like pool or darts, or you might just head back to the bar. Either way, a win!"
190, Do a themed photo shoot (professional or amateur),"Time to get all dressed up and get goofy. You could stick with one theme or try a few themes. Professional photoshoots are always great, but this one works just as well with cell phone cameras."
191, Go paintballing,"So, this one might be a bit intense if they’ve never been paintballing. If you have never tried it, go for it. It’s a blast. Just make sure you are okay with a little bit of stinging pain. Be on the same team though, no need to make your date mad by peppering them with paintballs."
192, Take a train ride somewhere,"Riding a train isn’t very common in a lot of places in the USA. But there is a good chance that there is a train station in your city or town. Just make sure you’ll be able to catch the train back!
193, Play laser tag together,"Not as much fun as paintball, but also less expensive and less painful. Just make sure your date is up for it. Laser tag, even though it’s pretty awesome, is not everyone’s idea of a fun date."
194, Go pick some fruit at a pick your own fruit farm,"Most towns or cities will have a farm where you can pay to pick your own fruit. You can take it back home and eat it fresh or make it into a dessert. Either way, it’ll give you a chance to get out of the house and chat while doing something together."
195, Create your own Olympics for you both to compete in,"This works great for double dates or with just two people. Make the events things you both can do equally well or poorly (highest card structure, quickest puzzle completion, etc.). Just make sure to not get TOO competitive with it. You could go all out and get some medals to give out too."
196, Search “challenge” on YouTube and do whatever buck-wild challenges you,"It kind of goes without saying that you should definitely film yourself doing the challenges. Just don’t go overboard and end up in the hospital, while it may make for a good story/video, it would be a lousy date. Have fun with it and see how crazy your date can be."
197, "\Find the nearest small stream. Make small boats and then race them,"If you bring along a picnic, you can make a day of it. Of course, this one is very weather dependent so you’ll have to decide if it will be a nice day out. But even if the weather is bad, we have plenty of other date ideas that are great for inside dates as well."
198, Go to an open mic night. Bonus points if one or both of you gets up on,"This one can be a bit hit or miss because at some open mic nights, it’s a little challenging to have a conversation with all the noise. But you’ll definitely have something to talk about afterward, and if one/both of you gets up on stage, it’ll surely be a memorable evening."
199, Set up an obstacle course in the back yard or at a park,"This is a really fun one for double dates. Each couple is a team and it often leads to some hilarious antics. Just remember, as with all the competitive date ideas, try not to take it too seriously. Oh, and try not to injure yourself."
200, Go to Target or Walmart. Buy cheap RC cars then race/crash/destroy them","There are all kinds of fun things you can do. Set up courses and jumps. Race them. Play tag with them. Cheap is key though. Some of the RC cars can get crazy expensive.
