91,Find something touristy in your area that neither of you has done and,Most locals never get around to doing the touristy stuff.Find out what is popular in your town on TripAdvisor and pretend to be atourist in your own town. You can even make up fake personas if you want.
92,"Shooting range, archery, ax throwing","Hit stuff with other stuff! Whether it’s a shooting range,archery range, or ax throwing range, it can be a ton of fun if you’ve nevertried it. And if you have tried it, you can always try to do better this time!This is another one that might be a little expensive but can definitely bememorable."
93,Go to a demolition derby,"This depends highly on where you live and if there are anydemolition derbies nearby. But if there are, this makes for a really memorabledate night. Just make sure to check if it is something your date will beinterested in."
94,Redo a field trip you enjoyed as a kid,We all took field trips as a kid. But when have you takenone as an adult? Go get in touch with your inner elementary school self andrelive an awesome field trip from the past.
95,Build and launch a rocket,"They are less expensive than you might imagine, and they canbe fun to put together. But the real fun part is when you launch them. They area great project to work on together, and you both can share in the experienceof launching it."
96,"Take to the skies (helicopter tour, hot air balloon, hang gliding, or","This one is expensive and if one of you has a fear of flyingdefinitely give this one a miss. But if you are up for spending the coin andenjoy a trip through the skies, this can be a ton of fun."
97,Paint some pottery,"There are quite a few places, usually at a mall, where youcan go and paint some pottery. Then they fire them, and you’ve got a souvenirfrom your date!"
98,Budget mad scientist/inventor,"Assign yourselves a budget of 10 or 20 dollars. Then go toWalmart or the Dollar Store and see what awesome contraption you can cobbletogether using only the things you bought with your budget. Creativity meetscrafts. It’s cheap, fun, and you’ll probably get a good story out of it!"
99,Explore a local national or state park,Chances are that there are at least a couple of national orstate parks within driving distance of you. Grab a takeout lunch and goexperience what the park has to offer. There’s nothing like getting out innature to soothe the soul.
100,Rent and beat a game together,This is a great date idea if you are both gamers. You canrent a game and try to beat it together in one marathon session. Just make sureit is either two-player or you both can pass the controller at regularintervals.
101,Get some coloring books and color,This one is on the super relaxed side. It’ll give you lotsof time to talk and can be quite soothing. Just make sure it’s something yourdate will enjoy. You can do it at a park or at a coffee shop.
102,Go to a car show,"This one can be kind of hit or miss depending on how muchyou both like cars. But even if you both aren’t super into cars, it’s a goodexcuse to walk around and talk. Plus, if you both have never been to a carshow, it might be a cool new experience."
103,Play disc golf,"This hobby often gets overlooked, but it’s fun and relativelycheap to start. And most towns and cities have a disc golf course. It’s a funway to spend the afternoon and gives you something to do while you are gettingto know each other."
104,Go to a local festival or fair,"If you live in a smaller town, there might not be so many festivals.But if you live in a bigger city, there are festivals of some type almost everymonth. Have a look at a city calendar and see if there is a fun festival."
105,Buy a puzzle and hit a coffee shop,"Like the coloring date idea, this one is really relaxing. Andthere is a lot of time to talk and get to know each other. You just have tomake sure that your date likes puzzles rather than finding them dull."
106,Jump in the water,"This one is kind of seasonally dependent. Going swimming inthe winter is not so fun. But there are usually indoor pools as well that youcan try. Just make sure your date likes swimming / can swim. You can hit up alake, community pool, or even buy some cheap kiddie pools."
107,Origami somewhere nice,"Even if you’ve never tried origami, it’s something you canpick up and start learning. It’s a lot more fun with some beautiful scenery. Sofind yourselves someplace nice and fold away."
108,Find a place you can make a campfire and make smores. Beers always go,"There is something hypnotic about watching a fire. It makesfor an easy, relaxing conversation. And who doesn’t love smores?"
109,Both of you try to learn a skill or trick that doesn&#8217;t take long to,"There are a lot of skills or tricks that don’t take long to learn. Some examples might be juggling, magic tricks, rolling a coin across your fingers, lockpicking, etc. You can find <a href=""https://www.reddit.com/r/AskReddit/comments/8m0tfg/what_is_a_skill_that_you_can_learn_in_a_day/"">lists of things like that on Reddit</a> and then find a how-to video on YouTube."
110,"Make a bucket list, talk about all the things you put on yours, steal",This is a great “get to know you” date idea. You can findout more about their goals and aspirations and see if they match or complementyour own. It’s a perfect activity for a coffee shop.
111,Buy and learn a new two-player card game,There are a ton of new card games out there that you canbuy. Or you can try learning a two-player card game with a normal deck ofcards. Be ready with another date idea just in case this one runs a littleshort.
112,Read up on some photography tips and go on a photography date and try,"Just pretend like you are art students. Go around town andtry to take the best pictures you possibly can with your phone camera. Get allartsy and see how it turns out. It’ll be a lot of fun going from place to placescouting out shots, and you can both have fun looking over the photos at lunchor dinner or over drinks."
113,Find your new favorite show,"Before the date, both of you should scout out a fewcandidates, then watch an episode or two together and decide yay or nay. If youboth give an enthusiastic yay, it’s binge time! This is another that works bestwith couples that have been together for a while."
114,"Be local critics, go to parks or things like that and write reviews","Become local Google Maps or Yelp stars. Go out, take somepictures, and give out some honest reviews together. If you want to save somemoney, go to places that are free like parks."
115,Play badminton in the park,"Badminton sets are pretty cheap, and it can be a fun way tospend time in the park. Plus, it is just physically challenging enough to befun but probably not enough to notice if you have differing levels of physicalability."
116,Listen to a podcast or audiobook together someplace nice,"So this is definitely not everyone’s idea of a great date,but a lot of people might enjoy being with the person they love, in a nicelocation, listening to a good book or podcast. Then if you want some talkingtime, you can always pause and discuss the book or podcast. A great idea if youare on a road trip as well."
117,Make some different types of homemade salsa,"After you make the salsa, what else is there to do but tohave some margaritas, and taste test your salsa with chips. Maybe make it intoa taco or nacho night. Loads of different types of salsa to try to make to suitall different types of tastes."
118,Do some legal urban exploring,"If you live in a city, there are all kinds of interesting buildings, ruins, nook and crannies, and other interesting spots perfect for <a href=""https://en.wikipedia.org/wiki/Urban_exploration"">urban exploration</a>. So if you both have a passion for exploring and live in a city, this can be a really cool date idea. Just make sure your date is totally on board, wear appropriate clothing, and stay legal."
119,Go bird watching,"Bird watching sometimes gets called boring, but really, it’sa great way to get outdoors. It gives you a reason to wander around in nature.Even if you’ve never done it, there are plenty of online guides out there toget started in your area. If nothing else, it’s probably something the both ofyou have never done before."
120,Go jogging,"If you are both into fitness and jogging, a jog can be agreat way to bond over something you both love. But this suggestion really onlyworks if you are both into jogging. If just one of you is, or if neither of youis, you might give this idea a pass."
121,Go on a walk through a park,"It’s relaxing, it’s free, it gives you plenty of time totalk. What’s not to love about taking a walk in the park on a date? You couldbring a frisbee, pack a lunch, and make a day of it. A lot of the other dateideas go well with a walk in the park."
122,Find a beautiful place to skip rocks,"This date idea is a great way to relax while still enjoyingnature. You won’t be doing it all day, but it’s a great add-on to a trip to apark."
123,People watch at a crowded location,"Sitting in a crowded place takes the pressure off having aconversation. You can just chat idly about this or that. Or you can discuss thepeople passing by and what their lives might be like. This one is reallydependent on the person. Some people love sitting and people watching, and somedon’t. One fun thing to do is create imaginary and fantastical backstories forthe people you are watching."
124,Volunteer somewhere,"Loads of places are looking for volunteers. Have a volunteerdate night, and you’ll be doing something awesome while getting to spend timewith your date."
125,Learn some Tai Chi,"Relaxing but still difficult. It’s great for your health andwellbeing and can make for a fun and interesting date idea. Especially ifneither of you has tried Tai Chi before. There are plenty of YouTube videos, oryou could see if there is a class. This is more a short date idea so try tohave something else on had to do before or after."
126,Learn a sleight of hand trick together,"This is kind of a neat one, because who doesn’t like a goodsleight of hand trick? Now you can be the one pulling quarters from people’sears. There are plenty of YouTube tutorial videos to choose from, just find onethat you both like and practice, practice, practice."
127,Go on a hike,"No matter where you live, there is probably a hiking trailor at least some kind of walking path within driving distance. Hikes are greatbecause you can chat while you walk. Plus, you can get out in nature and getsome exercise."
128,"Go to your local library, rent a book, take turns reading to each","With this one, the sillier it is, the more fun it is. Findan interesting fictional book and create some bombastic character voices. Youcan take turns reading, or each of you does a character."
129,Get stuff done date,"Okay so this sounds horrible, but it actually can be fun,and it’s definitely productive. Oh, and it’s meant mostly for couples who livetogether. Find some chores or stuff you can do together, blast some music, andopen up a bottle of wine or a few beers. It’s a way to make getting stuff donea little more fun, and you get to spend some time together."
130,Find a public place with a lot of litter and clean it up,"Similar to the volunteering or giving blood, this one isreally uncommon for a date idea. And you have to make sure your date will beinto it. But if you are both up for it, cleaning up a public space can be arewarding way to spend the afternoon."
131,"Get lyrical and write an original song, bonus points if you can also bust","This is a date idea that can be done at a bar or coffeeshop, at least the writing can be, you might want to do the actual singingsomewhere else. It can be a blast collaborating and is a great way to getcreative. Just make sure to have fun with it and don’t take it too seriously."
132,Take some trial fitness classes,"Most fitness places have trial classes for free. Give one ortwo of them a shot. It’ll make for a lively date, and you might even find aclass that you are really into."
133,"Make some YouTube videos, whether they be instructional, funny, or","Having a common goal or task can be a great way to have adate. And what better than to make goofy videos to put on YouTube. Even if youdon’t end up posting the videos, it can be a lot of fun making them togetherand then looking over them."
134,Both of you download an app/game in which you have to walk or travel,"There are a lot of these games for both Android and iOS. Ifyou search augmented reality games, you’ll probably find quite a few."
135,Pick out workout videos on YouTube and do them together,Definitely better if you both are into fitness and workingout. Doesn’t really work so well if neither of you is into fitness or if onlyone of you is.
136,Try to take artsy pictures of each other in different locations,"Basically, pretend to be photographers. Everyone appreciatesa good picture of themselves. And even if neither of you is a professional,that shouldn’t stop you from trying to get some awesome pictures. See if youcan get some photography tips online before heading out on the date."
137,Find an interesting neighborhood or suburb and walk and talk,"Whether it’s a super wealthy area or a historic district,find a cool neighborhood and walk around. You’ll be surprised at all thedetails you pick while walking that you might not normally see while driving."
138,Make slow motion videos with your phone,Most cell phones these days have a slow-motion feature onthem. You would be surprised how cool everyday stuff looks when you smash it orcrush it. You could also do some stunts. A full grown adult trying to dosomething they used to do all the time as kids can be pretty hilarious. Justmake sure not to get injured.
139,Go to the nearest airport and get to where you can watch them take off,"You’ll have to find somewhere that isn’t unbelievably noisy.I don’t want you all to be losing your hearing. But if you can find a greatspot, it really is neat to see these giant tubes of metal defying gravity."
140,Look through very old newspapers or magazines at the library,"Some folks will find this to be super boring, and some willfind it extremely interesting. It all depends on the person. But it can bereally interesting to find out what people 70 or 80 years ago were concerned orinterested in. You’ll probably find that there are a lot of parallels totoday’s news. Plus old ads are really cool. Just remember when you are goingthrough them not to get too loud."
141,A book club for two,"Each of you picks a short story, novella, or graphic novelfor the other to read, and then you get together on the date and discuss themover drinks. This one is an excellent idea if you are both into books. But Iwouldn’t suggest it unless you are both avid readers. If someone doesn’t readmuch, it might make them feel like they are preparing for a book report."
142,Do a seasonally themed date,"Do some stereotypical seasonal activities together likebuilding a snowman if it’s winter or going to the beach or pool if it’s summer.For fall or spring, you could carve a pumpkin or paint Easter eggs. Haveseasonal food and drinks after the activity."
143,Plan the perfect vacation,"This works best if you share a laptop. Otherwise, you end upboth looking at your phones or looking at your separate laptop. Find a countryor countries to visit, choose what you want to do, pick some impressive hotels.You’ll be able to see what they find fun and exciting and maybe get some moredate ideas for next time."
144,Build sandcastles together (no beach necessary),"No beach nearby? Not to worry. The hardware store sells playsand. Get some of that, a flat surface, some water, a place you don’t mindgetting wet and sandy, and you are good to go. You could do a full-on beach dayaway from the beach."
145,Make matching t-shirts,"So you can either get those iron on ones, or you can get acompany to print the designs on a shirt and send them to you. But the fun partis designing your shirts. Making them as ridiculous as possible. If neither ofyou has done much digital design, I would recommend checking out Canva forputting the images together."
146,Make masks,"Most craft stores will carry some type of blank masks, butif they don’t, there is always Amazon. Then just get together hang out anddecorate your masks. You can both do your own thing or have them based on a theme.Whatever works for both of you. Don’t worry if they turn out horrible, that’spart of the fun. Make sure to get some photos together after you finish!"
147,Do each other&#8217;s make up,"So this is probably more for established couples looking forcreative date ideas. And you have to make sure both of you are down for it. Butif you do this one, it can lead to some HILARIOUS results."
148,Bring your SO to work day,"This one is kind of a weird date, and it definitely dependson where you work. But with a lot of workplaces, you can show your SO around,and they can see what you do most days. Plus a lot of workplaces have somegreat perks you can take advantage of for a date! This is probably best done onyour day off but might be cool depending on the job."
149,Start learning a new language together,"Sure, you could learn some of the more popular ones. But whynot try an uncommon language or something like Esperanto. It would be great tohave a language that you both know, but most of those around you don’t."
150,Buy and read some comic books together,"Again, both of you will at least have to have a passinginterest in comic books. But if you both do, it can be neat to start a newseries that you haven’t read before. Try to pick one that both of you don’t knowmuch about. That way, you can both experience it with fresh eyes."
151,Take turns drawing a picture,"One person draws one part, and then the other does the nextpart. Or if you want a really interesting picture, one person draws until atimer runs out and then the next person goes."
152,Go get henna tattoos together,"It’s like getting regular tattoos together but a much lowerlevel of commitment. Just be sure that it isn’t in a place that will interferewith your job, they last 1 to 4 weeks."
153,Make a collage,"Test your artist prowess by making a collage, it takes awhile and provides you both with a lot of time to chat and get to know eachother. Plus it pairs pretty well with drinks."
154,Have an impromptu 4th of July celebration,Or any holiday really. Make a Thanksgiving dinner for thetwo of you or wear green and go out and have a bunch of beers and bring greenfood coloring for the beer.
155,Write a story together,"This is another date idea that is a little bit short but isstill pretty fun. Get a piece of paper, you write two sentences of a story thenpass it to them. Then they write two sentences. And then you write twosentences, they write two sentences, and so on. The story gets pretty crazypretty quickly."
156,Jump around at a trampoline park or obstacle course,"If your city or town has one of these, they are a blast. Alot of laughs, a decent workout, and a whole lot of fun. Just make sure not toget injured."
157,Go on a scavenger hunt together,"This is a great way to get out of the house and have funtogether without spending too much money. There are lots of scavenger huntideas online, or you can make one customized for you and your partner."
158,Go to a plant nursery and pick out a plant or two,"You can buy a plant or tree together and take care of it orbuy one for each of you. It’s a great way to have a souvenir from the date.Just try not to accidentally kill it like I do most of the plants I get. Plusnurseries have a lot of cool plants, and you can chat as you wander through allthe plants."
159,Go to an aquarium or aquarium store,Name the fish and make up backstories for them. Create alittle imaginary drama for them like they are finned day time soap operacharacters.
160,Do a photo booth crawl and make silly photos at every booth you can,"This one is a spinoff of the “crawl” idea I mentionedearlier and can be a great way to have a lot of fun on a date. It’s a perfectexcuse to act silly. On the way to the next booth, you can plan out what themeyou are going to do for your next set. Bonus points if you pick up props forthe photos at a dollar store."
161,Find a project on Pinterest or Instructables and make it together,"This works well because it gets you both working together.And once you’ve finished the project, you can look with pride on your creationor if it’s less than perfect, you can always have a good laugh. Plus, there areso many projects out there you are sure to find one that both of you areexcited about doing."
162,Watch a movie in the park or at a drive-in movie theater,"If there are no drive-ins in your area, make your own. Buysome snacks, find somewhere scenic to park, grab a tablet, put it on the dash."
163,"Buy some kites and go fly them, weather permitting of course","Who doesn’t like flying a kite? And when was the last timeyou flew a kite? This is one of those rom-com ideas, but it’ll be fun. Perfectfor a trip to the park."
164,Create a poster for a fictitious band or movie or one for a real one,"This can be a really fun project. Let your imagination gowild and try to make it as funny as possible. If you aren’t into digitaldesign, I would recommend Canva to make it easier. It’s free and prettyawesome. If you really want to go all out, you can get it printed out at aprint shop and put it up. It would make a great souvenir of a great date."
165,Get a couple’s massage,"This is one of the more expensive ideas on this list, butthey are a great way to relax together and have some downtime. Afterward, I’dhave something relaxing planned like sitting on a bench near a lake or river tocontinue that chill vibe."
166,Have an upscale picnic,"Location is key, so scout out a great spot at a local park.Then go all out with some wine (if they allow booze), cheese, sliced meats,French bread. Spread out a blanket on the ground or at a table, relax, and enjoybeing in each other’s company."
167,Take turns listening to each other&#8217;s favorite songs,This date idea works really well for those couples who lovemusic. You can introduce each other to awesome music. Nothing bonds peoplefaster than sharing in something that you both love.
168,Movies from your childhood night,"Find some movies that had a big impact on both yourchildhoods, pop some popcorn, and enjoy your trip down memory lane. It will bea great way to connect on some common ground, and you might be surprised at allthe things you don’t remember about your favorite childhood movies."
169,Pillow fort party,"Just like what it sounds, make a pillow fort together. Andnow that you are adults, you can make it even more amazing than the ones youmade as a kid. Once inside, do whatever you want, watch a movie, have drinksand chat, snuggle, do some gaming, whatever floats your collective boats!"
170,Cook a new recipe together,Find a recipe for something neither of you has ever made andmake it. It’s easy to chat while cooking and you get a dinner out of it aswell. You can even make shopping for ingredients part of the date. A bottle ofwine or beers helps the cooking process stay fun.
171,"Meet each in a bar, assume new identities, and try to pick each other","This depends a lot on whether you are into role-playing ornot. And is definitely more for couples who have been together for a while.That being said, it can be a great way to spice things up."
172,Create your own couple holiday including traditional food and,Make your own holiday that is customized to you and your SO.This works better for established couples and can be a lot of fun setting up anew tradition. You can even break it up into two dates. The first date forplanning and the second one for celebrating the holiday.
173,Pick a restaurant with a type of cuisine that neither of you has tried,"This one is a bit of a gamble because you won’t know if youboth will like the food or not. But if you are both adventurous, it can be alot of fun experiencing a new cuisine together. And you’ve both got a naturaltopic of conversation to fall back on, the new food! It can lead to a verymemorable date."
174,Star gazing road trip,"Find the area around your town with the least amount oflight pollution, bring some pillows and blankets, don’t forget the mosquito repellentand enjoy the night sky together."
175,A foreign country-themed date night,"Make that country&#8217;s food, listen to music from there, drinkbooze from there, watch a movie or TV show from there. It’s a fun way toexperience a different country’s traditions. This one works best if you pick acountry you don’t know much about."
176,Try to make convoluted cocktails,"This always a lot of fun. You can either try to make somecrazy cocktails/shots that have recipes, or you can try to make an originalcocktail. This one can be expensive if you go all out, but if you find theright recipe, it doesn’t have to be too crazy expensive."
177,Make flip books,"This is another creative date idea that might not fill afull evening, but it is a great way to spend time together doing somethingcreative. It’ll take the pressure off talking by giving you both something todo, and at the end, you’ll have a fun flip book. You could even put themtogether so that where one leaves off the other person’s begins."
178,Brew some beer together,"You’ll need a kit or a bunch of equipment for this one, andit can get a little expensive. Also, unfortunately, you both won’t get to trythe beer you brewed together that day. But then again, that could be the nextdate night. All that being said, though, doing something together is veryrewarding."
