179,"Pick a recipe, go shopping, and make a dessert together","Ice cream is a great choice, there are tons of DIY homemadeice cream methods. And it would work well with the pick your own fruit dateidea. But really any baked good is a great choice."
180,Attempt to learn calligraphy,"So, attempt is the key word here. You first few tries willprobably be a bit laughable, but it’s easy to start because there are plenty ofvideo tutorials online and beginner pens aren’t crazy expensive. So, give it ashot, be patient, and just remember failures can be as fun or more fun thansuccesses."
181,Do an Arduino or Raspberry Pi project together,"This one is definitely a bit technical, but it’s easier thanyou might think. There is a ton of documentation out there to help you alongand plenty of sample projects to choose from. Perfect if you both liketinkering."
182,Learn the rules of a sport you don’t know much about and watch a game,You can either watch the sport at a sports bar if there is agame going on or just watch some old games on the internet. There are tons ofgreat sports out there that you’ve probably never even heard of.
183,"Choose a series of movies that you’ll both enjoy, and have a daylong","Don’t forget the popcorn! This is a pretty chill date ideafor those who like staying at home. Some great options for movie series: Lordof the Rings, Star Wars, Avengers, Harry Potter, Die Hard, Bourne Identity, andThe Fast and the Furious. There are plenty of series to choose from."
184,Watch a movie you&#8217;ve both seen a bunch and try to make memes from it,"There are so many memes from movies and shows. Pick a moviethat you both love and see what kind of memes you can pull from it. Post themup in Reddit. Who knows, you might get a few upvotes and people might use oradapt your meme."
185,Write letters to folks who might want them or folks who don&#8217;t,"Are you both passionate about something? Write a letter tosomeone who might be able to do something about it. Love a celebrity ormusician? Write them a fan letter. Write a bunch of letters to a bunch ofpeople. Your local representative, celebrities, companies, prisoners, randompen pals in different countries. People underestimate the power of ahandwritten letter. You might even hear back from them!"
186,Have a cooking competition with whatever food you have in your or,"If both of you are comfortable with visiting the other’shouse on a date or if you live together, this can be an enjoyable way to spendthe evening. It forces you both to be creative and can lead to some hilariousresults."
187,Find a world record and try to break it,"There are some crazy world records out there. Find a fewthat look like it would be fun to try, and all of you give it a shot. Youprobably won’t beat the record, but I’m sure you’ll all have fun trying. And ifyou do beat it, how cool would that be?!"
188,Go to a roller-skating rink,"Chances are you have a roller rink in your town and chancesare you haven’t visited it in a very long time. So, head on over, lace up, andsee how much you remember about skating."
189,Darts or pool (best if everyone is bad at it),"Hit up a bar that has darts or pool and give it a go. Thereare lots of dart and pool games to try, so look up the rules for a game none ofyou has played and try it out. You might find you like pool or darts, or youmight just head back to the bar. Either way, a win!"
190,Do a themed photo shoot (professional or amateur),"Time to get all dressed up and get goofy. You could stickwith one theme or try a few themes. Professional photoshoots are always great,but this one works just as well with cell phone cameras."
191,Go paintballing,"So, this one might be a bit intense if they’ve never been paintballing.If you have never tried it, go for it. It’s a blast. Just make sure you areokay with a little bit of stinging pain. Be on the same team though, no need tomake your date mad by peppering them with paintballs."
192,Take a train ride somewhere,Riding a train isn’t very common in a lot of places in theUSA. But there is a good chance that there is a train station in your city ortown. Just make sure you’ll be able to catch the train back!
193,Play laser tag together,"Not as much fun as paintball, but also less expensive andless painful. Just make sure your date is up for it. Laser tag, even though it’spretty awesome, is not everyone’s idea of a fun date."
194,Go pick some fruit at a pick your own fruit farm,"Most towns or cities will have a farm where you can pay topick your own fruit. You can take it back home and eat it fresh or make it intoa dessert. Either way, it’ll give you a chance to get out of the house and chatwhile doing something together."
195,Create your own Olympics for you both to compete in,"This works great for double dates or with just two people.Make the events things you both can do equally well or poorly (highest cardstructure, quickest puzzle completion, etc.). Just make sure to not get TOOcompetitive with it. You could go all out and get some medals to give out too."
196,Search “challenge” on YouTube and do whatever buck-wild challenges you,"It kind of goes without saying that you should definitelyfilm yourself doing the challenges. Just don’t go overboard and end up in thehospital, while it may make for a good story / video, it would be a lousy date.Have fun with it and see how crazy your date can be."
197,"Find the nearest small stream, make small boats, and then race them","If you bring along a picnic, you can make a day of it. Ofcourse, this one is very weather dependent so you’ll have to decide if it willbe a nice day out. But even if the weather is bad, we have plenty of other dateideas that are great for inside dates as well."
198,Go to an open mic night. Bonus points if one or both of you gets up on,"This one can be a bit hit or miss because at some open micnights, it’s a little challenging to have a conversation with all the noise.But you’ll definitely have something to talk about afterward, and if one / bothof you gets up on stage, it’ll surely be a memorable evening."
199,Set up an obstacle course in the back yard or at a park,"This is a really fun one for double dates. Each couple is a teamand it often leads to some hilarious antics. Just remember, as with all thecompetitive date ideas, try not to take it too seriously. Oh, and try not toinjure yourself."
200,"Go to Target or Walmart, buy cheap RC cars, then race/crash/destruction",There are all kinds of fun things you can do. Set up courses and jumps. Race them. Play tag with them. Cheap is key though. Some of the RC cars can get crazy expensive.
